"","year","URL","lat","long","length","location","species","sci_names","date"
"55","2017","S35019489",14.3932784872674,101.3844163,62,"Khao Yai NP--Khao Khieo Rd. before Chao Po Khao Khieo Shrine","Abbott's Babbler, Alström's Warbler, Ashy Bulbul, Ashy Drongo, Asian Emerald Dove, Asian Fairy-bluebird, Asian Palm-Swift, Banded Bay Cuckoo, Banded Kingfisher, Bar-winged Flycatcher-shrike, Barn Swallow, Barred Cuckoo-Dove, Black-crested Bulbul, Black-naped Monarch, Blue Pitta, Blue-eared Barbet, Blue-winged Leafbird, Chestnut-headed Bee-eater, Collared Owlet, Coral-billed Ground-Cuckoo, Crimson Sunbird, Dark-necked Tailorbird, Eyebrowed Thrush, Fire-breasted Flowerpecker, Gray-eyed Bulbul, Gray-headed Canary-Flycatcher, Great Iora, Greater Flameback, Greater Racket-tailed Drongo, Greater Yellownape, Green-billed Malkoha, Green-eared Barbet, Hainan Blue Flycatcher, Heart-spotted Woodpecker, Hill Blue Flycatcher, Himalayan Swiftlet, Jerdon's Baza, Mountain Imperial-Pigeon, Moustached Barbet, Orange-breasted Trogon, Oriental Pied-Hornbill, Pale-legged Leaf Warbler, Pin-striped Tit-Babbler, Puff-throated Babbler, Puff-throated Bulbul, Radde's Warbler, Red Junglefowl, Red-headed Trogon, Scaly-breasted Partridge, Scarlet Minivet, Siamese Fireback, Siberian Blue Robin, Stripe-throated Bulbul, Sultan Tit, Two-barred Warbler, Velvet-fronted Nuthatch, Vernal Hanging-Parrot, White-bellied Erpornis, White-browed Scimitar-Babbler, White-crested Laughingthrush, White-rumped Shama, Yellow-browed Warbler","Malacocincla abbotti, Phylloscopus soror, Hemixos flavala, Dicrurus leucophaeus, Chalcophaps indica, Irena puella, Cypsiurus balasiensis, Cacomantis sonneratii, Lacedo pulchella, Hemipus picatus, Hirundo rustica, Macropygia unchall, Rubigula flaviventris, Hypothymis azurea, Hydrornis cyaneus, Psilopogon duvaucelii, Chloropsis cochinchinensis, Merops leschenaulti, Taenioptynx brodiei, Carpococcyx renauldi, Aethopyga siparaja, Orthotomus atrogularis, Turdus obscurus, Dicaeum ignipectus, Iole propinqua, Culicicapa ceylonensis, Aegithina lafresnayei, Chrysocolaptes guttacristatus, Dicrurus paradiseus, Chrysophlegma flavinucha, Phaenicophaeus tristis, Psilopogon faiostrictus, Cyornis hainanus, Hemicircus canente, Cyornis whitei, Aerodramus brevirostris, Aviceda jerdoni, Ducula badia, Psilopogon incognitus, Harpactes oreskios, Anthracoceros albirostris, Phylloscopus tenellipes, Mixornis gularis, Pellorneum ruficeps, Alophoixus pallidus, Phylloscopus schwarzi, Gallus gallus, Harpactes erythrocephalus, Tropicoperdix chloropus, Pericrocotus speciosus, Lophura diardi, Larvivora cyane, Pycnonotus finlaysoni, Melanochlora sultanea, Phylloscopus plumbeitarsus, Sitta frontalis, Loriculus vernalis, Erpornis zantholeuca, Pomatorhinus schisticeps, Garrulax leucolophus, Copsychus malabaricus, Phylloscopus inornatus","2017-03-07"
"56","2019","S100531374",14.3932784872674,101.3844163,63,"Khao Yai NP--Khao Khieo Rd. before Chao Po Khao Khieo Shrine","Abbott's Babbler, Ashy Drongo, Ashy Woodswallow, Asian Emerald Dove, Asian Palm-Swift, Banded Bay Cuckoo, Bar-winged Flycatcher-shrike, Barn Swallow, Barred Cuckoo-Dove, Black-and-buff Woodpecker, Black-crested Bulbul, Black-naped Monarch, Black-winged Cuckooshrike, Blue Pitta, Blue Rock-Thrush, Blue-bearded Bee-eater, Brown Shrike, Brown-backed Needletail, Brown-rumped Minivet, Chestnut-headed Bee-eater, Chinese Pond-Heron, Claudia's Leaf Warbler, Common Green-Magpie, Common Myna, Dark-necked Tailorbird, Golden-headed Cisticola, Gray-headed Canary-Flycatcher, Great Iora, Greater Coucal, Greater Yellownape, Green-billed Malkoha, Green-eared Barbet, Hill Blue Flycatcher, House Swift, Laced Woodpecker, Lesser Necklaced Laughingthrush, Little Cormorant, Little Spiderhunter, Moustached Barbet, Olive-backed Pipit, Oriental Pied-Hornbill, Paddyfield Pipit, Pale-legged Leaf Warbler, Puff-throated Babbler, Radde's Warbler, Red Junglefowl, Red-breasted Parakeet, Red-headed Trogon, Red-rumped Swallow, Red-wattled Lapwing, Rosy Minivet, Ruby-cheeked Sunbird, Silver Pheasant, Silver-backed Needletail, Sooty-headed Bulbul, Sulphur-breasted Warbler, Taiga Flycatcher, Two-barred Warbler, Vernal Hanging-Parrot, White-bellied Erpornis, White-browed Scimitar-Babbler, White-crested Laughingthrush, Yellow-browed Warbler","Malacocincla abbotti, Dicrurus leucophaeus, Artamus fuscus, Chalcophaps indica, Cypsiurus balasiensis, Cacomantis sonneratii, Hemipus picatus, Hirundo rustica, Macropygia unchall, Meiglyptes jugularis, Rubigula flaviventris, Hypothymis azurea, Lalage melaschistos, Hydrornis cyaneus, Monticola solitarius, Nyctyornis athertoni, Lanius cristatus, Hirundapus giganteus, Pericrocotus cantonensis, Merops leschenaulti, Ardeola bacchus, Phylloscopus claudiae, Cissa chinensis, Acridotheres tristis, Orthotomus atrogularis, Cisticola exilis, Culicicapa ceylonensis, Aegithina lafresnayei, Centropus sinensis, Chrysophlegma flavinucha, Phaenicophaeus tristis, Psilopogon faiostrictus, Cyornis whitei, Apus nipalensis, Picus vittatus, Garrulax monileger, Microcarbo niger, Arachnothera longirostra, Psilopogon incognitus, Anthus hodgsoni, Anthracoceros albirostris, Anthus rufulus, Phylloscopus tenellipes, Pellorneum ruficeps, Phylloscopus schwarzi, Gallus gallus, Psittacula alexandri, Harpactes erythrocephalus, Cecropis daurica, Vanellus indicus, Pericrocotus roseus, Chalcoparia singalensis, Lophura nycthemera, Hirundapus cochinchinensis, Pycnonotus aurigaster, Phylloscopus ricketti, Ficedula albicilla, Phylloscopus plumbeitarsus, Loriculus vernalis, Erpornis zantholeuca, Pomatorhinus schisticeps, Garrulax leucolophus, Phylloscopus inornatus","2019-03-07"
"57","1986","S66435009",4.37119679521622,102.3878467,78,"Taman Negara NP--Blau & Yong Hides","Pin-striped Tit-Babbler, White-breasted Waterhen, Black-headed Bulbul, Blue-rumped Parrot, Lesser Green Leafbird, Pacific Swallow, Whiskered Treeswift, Green Broadbill, Black-capped Kingfisher, Yellow-vented Flowerpecker, Chestnut-bellied Malkoha, Large Wren-Babbler, Crimson-breasted Flowerpecker, Gray-rumped Treeswift, Spectacled Spiderhunter, Red-throated Sunbird, Black-naped Monarch, Blue-crowned Hanging-Parrot, Crested Serpent-Eagle, Black-throated Babbler, Germain's Swiftlet, Brown-backed Needletail, Little Spiderhunter, Wreathed Hornbill, Gray-bellied Bulbul, Buff-rumped Woodpecker, Abbott's Babbler, Chestnut-rumped Babbler, Dark-throated Oriole, Sooty-capped Babbler, Spectacled Bulbul, Black-winged Flycatcher-shrike, Rufous-crowned Babbler, Long-billed Spiderhunter, Ochraceous Bulbul, Dark-necked Tailorbird, Spotted Fantail, Red-eyed Bulbul, Purple-naped Spiderhunter, Barn Swallow, Common Myna, Banded Woodpecker, Ruby-cheeked Sunbird, Raffles's Malkoha, Crested Shrikejay, Scaly-crowned Babbler, Rufous Piculet, Stork-billed Kingfisher, Tiger Shrike, Stripe-throated Bulbul, Gold-whiskered Barbet, Gray-and-buff Woodpecker, Little Green-Pigeon, Common Iora, White-bellied Erpornis, Bronzed Drongo, Crested Fireback, Black-and-yellow Broadbill, Gray-headed Canary-Flycatcher, Cream-vented Bulbul, Blyth's Paradise-Flycatcher, Hairy-backed Bulbul, Asian Brown Flycatcher, Yellow-eared Spiderhunter, Gray-breasted Spiderhunter, Black-bellied Malkoha, Black-thighed Falconet, Silver-rumped Needletail, Oriental Pied-Hornbill, Chestnut-winged Babbler, Rhinoceros Hornbill, Eurasian Tree Sparrow, Red Junglefowl, Black-and-red Broadbill, Yellow-breasted Flowerpecker, Ashy Tailorbird, Greater Racket-tailed Drongo, Yellow-bellied Bulbul","Mixornis gularis, Amaurornis phoenicurus, Brachypodius melanocephalos, Psittinus cyanurus, Chloropsis cyanopogon, Hirundo tahitica, Hemiprocne comata, Calyptomena viridis, Halcyon pileata, Dicaeum chrysorrheum, Phaenicophaeus sumatranus, Turdinus macrodactylus, Prionochilus percussus, Hemiprocne longipennis, Arachnothera flavigaster, Anthreptes rhodolaemus, Hypothymis azurea, Loriculus galgulus, Spilornis cheela, Stachyris nigricollis, Aerodramus germani, Hirundapus giganteus, Arachnothera longirostra, Rhyticeros undulatus, Rubigula cyaniventris, Meiglyptes tristis, Malacocincla abbotti, Stachyris maculata, Oriolus xanthonotus, Malacopteron affine, Rubigula erythropthalmos, Hemipus hirundinaceus, Malacopteron magnum, Arachnothera robusta, Alophoixus ochraceus, Orthotomus atrogularis, Rhipidura perlata, Pycnonotus brunneus, Kurochkinegramma hypogrammicum, Hirundo rustica, Acridotheres tristis, Chrysophlegma miniaceum, Chalcoparia singalensis, Rhinortha chlorophaea, Platylophus galericulatus, Malacopteron cinereum, Sasia abnormis, Pelargopsis capensis, Lanius tigrinus, Pycnonotus finlaysoni, Psilopogon chrysopogon, Hemicircus concretus, Treron olax, Aegithina tiphia, Erpornis zantholeuca, Dicrurus aeneus, Lophura ignita, Eurylaimus ochromalus, Culicicapa ceylonensis, Pycnonotus simplex, Terpsiphone affinis, Tricholestes criniger, Muscicapa dauurica, Arachnothera chrysogenys, Arachnothera modesta, Phaenicophaeus diardi, Microhierax fringillarius, Rhaphidura leucopygialis, Anthracoceros albirostris, Cyanoderma erythropterum, Buceros rhinoceros, Passer montanus, Gallus gallus, Cymbirhynchus macrorhynchos, Prionochilus maculatus, Orthotomus ruficeps, Dicrurus paradiseus, Alophoixus phaeocephalus","1986-02-02"
"58","1986","S66471585",4.37119679521622,102.3878467,57,"Taman Negara NP--Blau & Yong Hides","Gray-headed Canary-Flycatcher, Rufous-crowned Babbler, Chestnut-winged Babbler, Barn Swallow, Crested Fireback, Green Iora, Maroon-breasted Philentoma, Large Wren-Babbler, Dark-throated Oriole, White-crowned Hornbill, Puff-backed Bulbul, Pacific Swallow, Rufous-chested Flycatcher, Thick-billed Spiderhunter, Wreathed Hornbill, White-bellied Erpornis, White-bellied Sea-Eagle, Spectacled Bulbul, Maroon Woodpecker, Banded Kingfisher, White-throated Kingfisher, Raffles's Malkoha, Black-and-yellow Broadbill, Banded Broadbill, Red-eyed Bulbul, Bronzed Drongo, Spotted Fantail, Hairy-backed Bulbul, Striated Heron, Black-naped Monarch, Scaly-crowned Babbler, Arctic Warbler, Common Kingfisher, Oriental Pied-Hornbill, Blyth's Paradise-Flycatcher, Black Magpie, Brown-backed Needletail, Scarlet-rumped Trogon, Silver-rumped Needletail, Chestnut-naped Forktail, Purple-naped Spiderhunter, Garnet Pitta, Black-and-red Broadbill, Asian Fairy-bluebird, Square-tailed Drongo-Cuckoo, Siberian Blue Robin, Black-capped Babbler, Rufous-winged Philentoma, Crimson-winged Woodpecker, Black-throated Babbler, Spectacled Spiderhunter, Germain's Swiftlet, Rufous-tailed Tailorbird, Plain Sunbird, Yellow-bellied Bulbul, Diard's Trogon, Greater Racket-tailed Drongo","Culicicapa ceylonensis, Malacopteron magnum, Cyanoderma erythropterum, Hirundo rustica, Lophura ignita, Aegithina viridissima, Philentoma velata, Turdinus macrodactylus, Oriolus xanthonotus, Berenicornis comatus, Brachypodius eutilotus, Hirundo tahitica, Ficedula dumetoria, Arachnothera crassirostris, Rhyticeros undulatus, Erpornis zantholeuca, Haliaeetus leucogaster, Rubigula erythropthalmos, Blythipicus rubiginosus, Lacedo pulchella, Halcyon smyrnensis, Rhinortha chlorophaea, Eurylaimus ochromalus, Eurylaimus javanicus, Pycnonotus brunneus, Dicrurus aeneus, Rhipidura perlata, Tricholestes criniger, Butorides striata, Hypothymis azurea, Malacopteron cinereum, Phylloscopus borealis, Alcedo atthis, Anthracoceros albirostris, Terpsiphone affinis, Platysmurus leucopterus, Hirundapus giganteus, Harpactes duvaucelii, Rhaphidura leucopygialis, Enicurus ruficapillus, Kurochkinegramma hypogrammicum, Erythropitta granatina, Cymbirhynchus macrorhynchos, Irena puella, Surniculus lugubris, Larvivora cyane, Pellorneum capistratum, Philentoma pyrhoptera, Picus puniceus, Stachyris nigricollis, Arachnothera flavigaster, Aerodramus germani, Orthotomus sericeus, Anthreptes simplex, Alophoixus phaeocephalus, Harpactes diardii, Dicrurus paradiseus","1986-02-09"
"59","1986","S66476659",4.37119679521622,102.3878467,73,"Taman Negara NP--Blau & Yong Hides","Spotted Fantail, Striated Heron, Black-capped Kingfisher, Ochraceous Bulbul, Gray-breasted Spiderhunter, Red-throated Barbet, Hodgson's Hawk-Cuckoo, Silver-rumped Needletail, Purple-naped Spiderhunter, Spectacled Bulbul, Rhinoceros Hornbill, Barn Swallow, Short-toed Coucal, Gray-rumped Treeswift, Lesser Green Leafbird, Great Slaty Woodpecker, Bronzed Drongo, Raffles's Malkoha, Asian Brown Flycatcher, Chestnut-breasted Malkoha, Hairy-backed Bulbul, Black-headed Bulbul, Common Myna, White-rumped Munia, Black-throated Babbler, Yellow-vented Bulbul, Oriental Pied-Hornbill, Green Broadbill, Blue-crowned Hanging-Parrot, Rufous-tailed Tailorbird, House Swift, Chestnut-winged Babbler, Red-eyed Bulbul, Scarlet-rumped Trogon, Bat Hawk, Long-billed Spiderhunter, Crested Fireback, Short-tailed Babbler, Asian Fairy-bluebird, Eurasian Tree Sparrow, Great Argus, Spectacled Spiderhunter, Yellow-bellied Bulbul, Dusky Broadbill, Sooty-capped Babbler, Maroon-breasted Philentoma, Brown Boobook, Gray-headed Canary-Flycatcher, Rufous-crowned Babbler, Crested Partridge, Buff-rumped Woodpecker, Maroon Woodpecker, Pacific Swallow, Scaly-crowned Babbler, Moustached Babbler, Black-naped Monarch, Germain's Swiftlet, White-chested Babbler, Blyth's Paradise-Flycatcher, Chestnut-rumped Babbler, Orange-backed Woodpecker, Arctic Warbler, Black-capped Babbler, Common Iora, Dollarbird, Wrinkled Hornbill, Stork-billed Kingfisher, Little Green-Pigeon, Red-throated Sunbird, Crested Serpent-Eagle, Crimson-breasted Flowerpecker, Black Magpie, Streaked Bulbul","Rhipidura perlata, Butorides striata, Halcyon pileata, Alophoixus ochraceus, Arachnothera modesta, Psilopogon mystacophanos, Hierococcyx nisicolor, Rhaphidura leucopygialis, Kurochkinegramma hypogrammicum, Rubigula erythropthalmos, Buceros rhinoceros, Hirundo rustica, Centropus rectunguis, Hemiprocne longipennis, Chloropsis cyanopogon, Mulleripicus pulverulentus, Dicrurus aeneus, Rhinortha chlorophaea, Muscicapa dauurica, Phaenicophaeus curvirostris, Tricholestes criniger, Brachypodius melanocephalos, Acridotheres tristis, Lonchura striata, Stachyris nigricollis, Pycnonotus goiavier, Anthracoceros albirostris, Calyptomena viridis, Loriculus galgulus, Orthotomus sericeus, Apus nipalensis, Cyanoderma erythropterum, Pycnonotus brunneus, Harpactes duvaucelii, Macheiramphus alcinus, Arachnothera robusta, Lophura ignita, Pellorneum malaccense, Irena puella, Passer montanus, Argusianus argus, Arachnothera flavigaster, Alophoixus phaeocephalus, Corydon sumatranus, Malacopteron affine, Philentoma velata, Ninox scutulata, Culicicapa ceylonensis, Malacopteron magnum, Rollulus rouloul, Meiglyptes tristis, Blythipicus rubiginosus, Hirundo tahitica, Malacopteron cinereum, Malacopteron magnirostre, Hypothymis azurea, Aerodramus germani, Pellorneum rostratum, Terpsiphone affinis, Stachyris maculata, Reinwardtipicus validus, Phylloscopus borealis, Pellorneum capistratum, Aegithina tiphia, Eurystomus orientalis, Rhabdotorrhinus corrugatus, Pelargopsis capensis, Treron olax, Anthreptes rhodolaemus, Spilornis cheela, Prionochilus percussus, Platysmurus leucopterus, Ixos malaccensis","1986-02-10"
"60","1986","S66601803",4.37119679521622,102.3878467,81,"Taman Negara NP--Blau & Yong Hides","Little Green-Pigeon, Large Wren-Babbler, Large Green-Pigeon, Barn Swallow, Ashy Tailorbird, Stork-billed Kingfisher, Red-throated Barbet, Fluffy-backed Tit-Babbler, Moustached Babbler, Asian Fairy-bluebird, Ferruginous Babbler, Ochraceous Bulbul, Oriental Pied-Hornbill, Black-and-yellow Broadbill, Brown Boobook, Raffles's Malkoha, Long-billed Spiderhunter, Black-capped Babbler, Rhinoceros Hornbill, Sooty-capped Babbler, Buff-rumped Woodpecker, Temminck's Sunbird, Crimson-winged Woodpecker, Common Sandpiper, Eastern Crowned Warbler, Scarlet-rumped Trogon, Common Kingfisher, Rufous-winged Philentoma, Pacific Swallow, Bronzed Drongo, Short-tailed Babbler, Purple-naped Spiderhunter, Greater Racket-tailed Drongo, Scaly-crowned Babbler, Black-headed Bulbul, Brown-backed Needletail, Chestnut-rumped Babbler, Malayan Banded-Pitta, Dark-throated Oriole, Lesser Green Leafbird, Pacific Swift, Germain's Swiftlet, Buff-vented Bulbul, Gray-bellied Bulbul, Crested Partridge, White-chested Babbler, Dark-necked Tailorbird, Asian Emerald Dove, White-throated Kingfisher, Lesser Cuckooshrike, Short-toed Coucal, Spectacled Spiderhunter, Crested Fireback, Black-naped Monarch, Yellow-vented Flowerpecker, Arctic Warbler, White-bellied Erpornis, Yellow-bellied Bulbul, Banded Woodpecker, Chestnut-winged Babbler, Black-throated Babbler, Gray-rumped Treeswift, Orange-backed Woodpecker, Slender-billed Crow, Red-eyed Bulbul, Puff-backed Bulbul, Hairy-backed Bulbul, Gray-breasted Spiderhunter, Blyth's Hawk-Eagle, Gray-headed Babbler, Chestnut-backed Scimitar-Babbler, Striated Heron, Malaysian Eared-Nightjar, Rufous-crowned Babbler, Silver-rumped Needletail, Spotted Fantail, Little Spiderhunter, Siberian Blue Robin, Crestless Fireback, Amur Paradise-Flycatcher, Maroon-breasted Philentoma","Treron olax, Turdinus macrodactylus, Treron capellei, Hirundo rustica, Orthotomus ruficeps, Pelargopsis capensis, Psilopogon mystacophanos, Macronus ptilosus, Malacopteron magnirostre, Irena puella, Pellorneum bicolor, Alophoixus ochraceus, Anthracoceros albirostris, Eurylaimus ochromalus, Ninox scutulata, Rhinortha chlorophaea, Arachnothera robusta, Pellorneum capistratum, Buceros rhinoceros, Malacopteron affine, Meiglyptes tristis, Aethopyga temminckii, Picus puniceus, Actitis hypoleucos, Phylloscopus coronatus, Harpactes duvaucelii, Alcedo atthis, Philentoma pyrhoptera, Hirundo tahitica, Dicrurus aeneus, Pellorneum malaccense, Kurochkinegramma hypogrammicum, Dicrurus paradiseus, Malacopteron cinereum, Brachypodius melanocephalos, Hirundapus giganteus, Stachyris maculata, Hydrornis irena, Oriolus xanthonotus, Chloropsis cyanopogon, Apus pacificus, Aerodramus germani, Iole crypta, Rubigula cyaniventris, Rollulus rouloul, Pellorneum rostratum, Orthotomus atrogularis, Chalcophaps indica, Halcyon smyrnensis, Lalage fimbriata, Centropus rectunguis, Arachnothera flavigaster, Lophura ignita, Hypothymis azurea, Dicaeum chrysorrheum, Phylloscopus borealis, Erpornis zantholeuca, Alophoixus phaeocephalus, Chrysophlegma miniaceum, Cyanoderma erythropterum, Stachyris nigricollis, Hemiprocne longipennis, Reinwardtipicus validus, Corvus enca, Pycnonotus brunneus, Brachypodius eutilotus, Tricholestes criniger, Arachnothera modesta, Nisaetus alboniger, Stachyris poliocephala, Pomatorhinus montanus, Butorides striata, Lyncornis temminckii, Malacopteron magnum, Rhaphidura leucopygialis, Rhipidura perlata, Arachnothera longirostra, Larvivora cyane, Lophura erythrophthalma, Terpsiphone incei, Philentoma velata","1986-02-11"
"61","1986","S66655072",4.37119679521622,102.3878467,98,"Taman Negara NP--Blau & Yong Hides","Black-and-red Broadbill, Malayan Banded-Pitta, Black-and-yellow Broadbill, Crimson-breasted Flowerpecker, White-chested Babbler, Maroon Woodpecker, Asian Fairy-bluebird, Black-bellied Malkoha, Pacific Swallow, Scarlet Minivet, Buff-rumped Woodpecker, Red-throated Sunbird, Black-capped Babbler, Dark-necked Tailorbird, Rufous-tailed Tailorbird, Brown-backed Needletail, Chestnut-rumped Babbler, Banded Woodpecker, Little Green-Pigeon, White-necked Babbler, Chestnut-naped Forktail, Malaysian Eared-Nightjar, Gray Wagtail, Dusky Broadbill, Gray-breasted Spiderhunter, Stork-billed Kingfisher, Velvet-fronted Nuthatch, Streaked Bulbul, Striped Wren-Babbler, Crested Shrikejay, Gray-bellied Bulbul, Little Spiderhunter, Osprey, Barn Swallow, Asian Brown Flycatcher, Amur Paradise-Flycatcher, Chestnut-breasted Malkoha, Finsch's Bulbul, Pink-necked Green-Pigeon, Spotted Fantail, Arctic Warbler, Common Myna, Crested Partridge, Whiskered Treeswift, Blue-crowned Hanging-Parrot, Rhinoceros Hornbill, Dark-throated Oriole, Yellow-eared Spiderhunter, Brush Cuckoo, Garnet Pitta, Green Broadbill, Malayan Peacock-Pheasant, Hairy-backed Bulbul, Oriental Pied-Hornbill, Red-throated Barbet, Rufous Piculet, Ferruginous Babbler, Great Argus, Purple-naped Spiderhunter, Moustached Babbler, Jambu Fruit-Dove, Pacific Swift, Puff-backed Bulbul, Bronzed Drongo, Blue-throated Bee-eater, Eurasian Tree Sparrow, Orange-backed Woodpecker, Diard's Trogon, Maroon-breasted Philentoma, House Swift, Large Green-Pigeon, Pin-striped Tit-Babbler, Temminck's Sunbird, Raffles's Malkoha, Yellow-vented Bulbul, Stripe-throated Bulbul, Yellow-bellied Bulbul, Scaly-crowned Babbler, Cream-vented Bulbul, Black-naped Monarch, Gray-rumped Treeswift, Gray-and-buff Woodpecker, Siberian Blue Robin, Rufous-crowned Babbler, Banded Kingfisher, Silver-rumped Needletail, Long-billed Spiderhunter, Red-eyed Bulbul, Greater Racket-tailed Drongo, Mugimaki Flycatcher, Hodgson's Hawk-Cuckoo, Black-nest Swiftlet, Large Wren-Babbler, Chestnut-winged Babbler, Black-throated Babbler, Spectacled Bulbul, Yellow-breasted Flowerpecker, Bushy-crested Hornbill","Cymbirhynchus macrorhynchos, Hydrornis irena, Eurylaimus ochromalus, Prionochilus percussus, Pellorneum rostratum, Blythipicus rubiginosus, Irena puella, Phaenicophaeus diardi, Hirundo tahitica, Pericrocotus speciosus, Meiglyptes tristis, Anthreptes rhodolaemus, Pellorneum capistratum, Orthotomus atrogularis, Orthotomus sericeus, Hirundapus giganteus, Stachyris maculata, Chrysophlegma miniaceum, Treron olax, Stachyris leucotis, Enicurus ruficapillus, Lyncornis temminckii, Motacilla cinerea, Corydon sumatranus, Arachnothera modesta, Pelargopsis capensis, Sitta frontalis, Ixos malaccensis, Kenopia striata, Platylophus galericulatus, Rubigula cyaniventris, Arachnothera longirostra, Pandion haliaetus, Hirundo rustica, Muscicapa dauurica, Terpsiphone incei, Phaenicophaeus curvirostris, Alophoixus finschii, Treron vernans, Rhipidura perlata, Phylloscopus borealis, Acridotheres tristis, Rollulus rouloul, Hemiprocne comata, Loriculus galgulus, Buceros rhinoceros, Oriolus xanthonotus, Arachnothera chrysogenys, Cacomantis variolosus, Erythropitta granatina, Calyptomena viridis, Polyplectron malacense, Tricholestes criniger, Anthracoceros albirostris, Psilopogon mystacophanos, Sasia abnormis, Pellorneum bicolor, Argusianus argus, Kurochkinegramma hypogrammicum, Malacopteron magnirostre, Ptilinopus jambu, Apus pacificus, Brachypodius eutilotus, Dicrurus aeneus, Merops viridis, Passer montanus, Reinwardtipicus validus, Harpactes diardii, Philentoma velata, Apus nipalensis, Treron capellei, Mixornis gularis, Aethopyga temminckii, Rhinortha chlorophaea, Pycnonotus goiavier, Pycnonotus finlaysoni, Alophoixus phaeocephalus, Malacopteron cinereum, Pycnonotus simplex, Hypothymis azurea, Hemiprocne longipennis, Hemicircus concretus, Larvivora cyane, Malacopteron magnum, Lacedo pulchella, Rhaphidura leucopygialis, Arachnothera robusta, Pycnonotus brunneus, Dicrurus paradiseus, Ficedula mugimaki, Hierococcyx nisicolor, Aerodramus maximus, Turdinus macrodactylus, Cyanoderma erythropterum, Stachyris nigricollis, Rubigula erythropthalmos, Prionochilus maculatus, Anorrhinus galeritus","1986-02-12"
"62","1993","S69441551",4.37119679521622,102.3878467,64,"Taman Negara NP--Blau & Yong Hides","Large Woodshrike, Little Green-Pigeon, Purple-naped Spiderhunter, Blyth's Paradise-Flycatcher, Bar-bellied Cuckooshrike, House Swift, Crested Shrikejay, Cinnamon-rumped Trogon, Black-and-white Bulbul, Sooty-capped Babbler, Gold-whiskered Barbet, Dollarbird, Eurasian Tree Sparrow, Silver-rumped Needletail, Long-billed Spiderhunter, Greater Racket-tailed Drongo, Barred Eagle-Owl, Yellow-bellied Bulbul, Buff-necked Woodpecker, Blyth's Frogmouth, Square-tailed Drongo-Cuckoo, Ashy Minivet, Red-eyed Bulbul, Rufous-crowned Babbler, Asian Emerald Dove, Ferruginous Babbler, Mountain Imperial-Pigeon, Olive-backed Woodpecker, Brown Boobook, Scarlet-rumped Trogon, Dark-necked Tailorbird, Blue-throated Bee-eater, Gray-rumped Treeswift, Streaked Bulbul, White-throated Kingfisher, Black-and-red Broadbill, Black-naped Monarch, Barn Swallow, Abbott's Babbler, Verditer Flycatcher, Buff-vented Bulbul, Bronzed Drongo, Blue-crowned Hanging-Parrot, Rufous-tailed Tailorbird, Garnet Pitta, Stripe-throated Bulbul, Asian Fairy-bluebird, Red-naped Trogon, Rufous-winged Philentoma, Gray-bellied Bulbul, Sooty Barbet, Brown-backed Needletail, Buffy Fish-Owl, Dark-throated Oriole, Gray-breasted Spiderhunter, Crimson-winged Woodpecker, Crested Fireback, Red-throated Barbet, Hairy-backed Bulbul, Scarlet Minivet, Oriental Pied-Hornbill, Yellow-vented Bulbul, Banded Kingfisher, Black-winged Flycatcher-shrike","Tephrodornis virgatus, Treron olax, Kurochkinegramma hypogrammicum, Terpsiphone affinis, Coracina striata, Apus nipalensis, Platylophus galericulatus, Harpactes orrhophaeus, Brachypodius melanoleucos, Malacopteron affine, Psilopogon chrysopogon, Eurystomus orientalis, Passer montanus, Rhaphidura leucopygialis, Arachnothera robusta, Dicrurus paradiseus, Bubo sumatranus, Alophoixus phaeocephalus, Meiglyptes tukki, Batrachostomus affinis, Surniculus lugubris, Pericrocotus divaricatus, Pycnonotus brunneus, Malacopteron magnum, Chalcophaps indica, Pellorneum bicolor, Ducula badia, Dinopium rafflesii, Ninox scutulata, Harpactes duvaucelii, Orthotomus atrogularis, Merops viridis, Hemiprocne longipennis, Ixos malaccensis, Halcyon smyrnensis, Cymbirhynchus macrorhynchos, Hypothymis azurea, Hirundo rustica, Malacocincla abbotti, Eumyias thalassinus, Iole crypta, Dicrurus aeneus, Loriculus galgulus, Orthotomus sericeus, Erythropitta granatina, Pycnonotus finlaysoni, Irena puella, Harpactes kasumba, Philentoma pyrhoptera, Rubigula cyaniventris, Caloramphus hayii, Hirundapus giganteus, Ketupa ketupu, Oriolus xanthonotus, Arachnothera modesta, Picus puniceus, Lophura ignita, Psilopogon mystacophanos, Tricholestes criniger, Pericrocotus speciosus, Anthracoceros albirostris, Pycnonotus goiavier, Lacedo pulchella, Hemipus hirundinaceus","1993-03-30"
