"","year","URL","lat","long","length","location","species","sci_names","date"
"143","2019","S61257231",-23.0247712259628,-44.55277282,79,"Parque Mambucaba--Estrada do Chapeu do Sol","Red-rumped Cacique, Ruddy Ground Dove, Gray-hooded Attila, Buff-throated Saltator, Great Egret, Double-collared Seedeater, Brazilian Tanager, White-barred Piculet, Chestnut-backed Antshrike, Black-throated Grosbeak, White-bearded Manakin, White-tipped Dove, Chestnut-bellied Seed-Finch, Mantled Hawk, Southern Rough-winged Swallow, Swallow Tanager, Rufous-capped Antthrush, Rufous-tailed Jacamar, Chestnut-bellied Euphonia, Sepia-capped Flycatcher, Rufous-capped Spinetail, Green-barred Woodpecker, Spot-breasted Antvireo, Unicolored Antwren, White-shouldered Fire-eye, Green-backed Trogon, Ruby-crowned Tanager, Blue Dacnis, Fork-tailed Pygmy-Tyrant, Spix's Spinetail, Tufted Antshrike, Squirrel Cuckoo, Yellow-eared Woodpecker, Palm Tanager, Plumbeous Pigeon, Saw-billed Hermit, Green-headed Tanager, Streaked Flycatcher, Rufous-capped Motmot, Swallow-tailed Hummingbird, Long-tailed Tyrant, Swallow-tailed Manakin, Orange-eyed Thornbird, Scaled Antbird, Chivi Vireo, Sayaca Tanager, Saffron Finch, White-collared Swift, Brazilian Ruby, Striped Cuckoo, Lemon-chested Greenlet, Ferruginous Antbird, Black Vulture, Black Jacobin, Golden-chevroned Tanager, Spot-backed Antshrike, Cobalt-rumped Parrotlet, Bananaquit, Great Kiskadee, Black-hooded Antwren, Euler's Flycatcher, Gray-headed Tody-Flycatcher, Reddish Hermit, Magnificent Frigatebird, Riverbank Warbler, Sooty Swift, Rufous-margined Antwren, Rufous-bellied Thrush, Yellow-throated Woodpecker, Versicolored Emerald, Boat-billed Flycatcher, Social Flycatcher, Yellow Tyrannulet, Red-necked Tanager, Long-billed Gnatwren, Brown Tinamou, Streak-capped Antwren, Masked Yellowthroat, Tropical Parula","Cacicus haemorrhous, Columbina talpacoti, Attila rufus, Saltator maximus, Ardea alba, Sporophila caerulescens, Ramphocelus bresilius, Picumnus cirratus, Thamnophilus palliatus, Saltator fuliginosus, Manacus manacus, Leptotila verreauxi, Sporophila angolensis, Pseudastur polionotus, Stelgidopteryx ruficollis, Tersina viridis, Formicarius colma, Galbula ruficauda, Euphonia pectoralis, Leptopogon amaurocephalus, Synallaxis ruficapilla, Colaptes melanochloros, Dysithamnus stictothorax, Myrmotherula unicolor, Pyriglena leucoptera, Trogon viridis, Tachyphonus coronatus, Dacnis cayana, Hemitriccus furcatus, Synallaxis spixi, Mackenziaena severa, Piaya cayana, Dryobates maculifrons, Thraupis palmarum, Patagioenas plumbea, Ramphodon naevius, Tangara seledon, Myiodynastes maculatus, Baryphthengus ruficapillus, Eupetomena macroura, Colonia colonus, Chiroxiphia caudata, Phacellodomus erythrophthalmus, Drymophila squamata, Vireo chivi, Thraupis sayaca, Sicalis flaveola, Streptoprocne zonaris, Clytolaema rubricauda, Tapera naevia, Hylophilus thoracicus, Drymophila ferruginea, Coragyps atratus, Florisuga fusca, Thraupis ornata, Hypoedaleus guttatus, Forpus xanthopterygius, Coereba flaveola, Pitangus sulphuratus, Formicivora erythronotos, Lathrotriccus euleri, Todirostrum poliocephalum, Phaethornis ruber, Fregata magnificens, Myiothlypis rivularis, Cypseloides fumigatus, Herpsilochmus rufimarginatus, Turdus rufiventris, Piculus flavigula, Chrysuronia versicolor, Megarynchus pitangua, Myiozetetes similis, Capsiempis flaveola, Tangara cyanocephala, Ramphocaenus melanurus, Crypturellus obsoletus, Terenura maculata, Geothlypis aequinoctialis, Setophaga pitiayumi","2019-11-03"
"144","2020","S75149296",-23.0247712259628,-44.55277282,57,"Parque Mambucaba--Estrada do Chapeu do Sol","Black Vulture, Black-and-white Hawk-Eagle, Black-hooded Antwren, Black-throated Grosbeak, Blue Dacnis, Blue-black Grassquit, Brazilian Tanager, Buff-throated Saltator, Chestnut-backed Antshrike, Chestnut-bellied Euphonia, Chestnut-crowned Becard, Chestnut-vented Conebill, Ferruginous Antbird, Fork-tailed Pygmy-Tyrant, Gray-headed Tody-Flycatcher, Gray-hooded Attila, Great Kiskadee, Green-backed Trogon, Green-headed Tanager, Long-billed Gnatwren, Long-billed Wren, Long-tailed Tyrant, Magnificent Frigatebird, Magpie Tanager, Orange-eyed Thornbird, Palm Tanager, Piratic Flycatcher, Plumbeous Pigeon, Red-breasted Toucan, Red-necked Tanager, Red-rumped Cacique, Ruddy Ground Dove, Rufous-bellied Thrush, Rufous-capped Motmot, Rufous-capped Spinetail, Rufous-headed Tanager, Rufous-margined Antwren, Rufous-thighed Kite, Saffron Toucanet, Saw-billed Hermit, Sayaca Tanager, Scaled Antbird, Sepia-capped Flycatcher, Slaty Bristlefront, Southern Rough-winged Swallow, Streak-capped Antwren, Striped Cuckoo, Swallow Tanager, Swallow-tailed Manakin, Violet-capped Woodnymph, White-bearded Manakin, White-shouldered Fire-eye, White-thighed Swallow, Yellow Tyrannulet, Yellow-eared Woodpecker, Yellow-fronted Woodpecker, Yellow-legged Thrush","Coragyps atratus, Spizaetus melanoleucus, Formicivora erythronotos, Saltator fuliginosus, Dacnis cayana, Volatinia jacarina, Ramphocelus bresilius, Saltator maximus, Thamnophilus palliatus, Euphonia pectoralis, Pachyramphus castaneus, Conirostrum speciosum, Drymophila ferruginea, Hemitriccus furcatus, Todirostrum poliocephalum, Attila rufus, Pitangus sulphuratus, Trogon viridis, Tangara seledon, Ramphocaenus melanurus, Cantorchilus longirostris, Colonia colonus, Fregata magnificens, Cissopis leverianus, Phacellodomus erythrophthalmus, Thraupis palmarum, Legatus leucophaius, Patagioenas plumbea, Ramphastos dicolorus, Tangara cyanocephala, Cacicus haemorrhous, Columbina talpacoti, Turdus rufiventris, Baryphthengus ruficapillus, Synallaxis ruficapilla, Hemithraupis ruficapilla, Herpsilochmus rufimarginatus, Harpagus diodon, Pteroglossus bailloni, Ramphodon naevius, Thraupis sayaca, Drymophila squamata, Leptopogon amaurocephalus, Merulaxis ater, Stelgidopteryx ruficollis, Terenura maculata, Tapera naevia, Tersina viridis, Chiroxiphia caudata, Thalurania glaucopis, Manacus manacus, Pyriglena leucoptera, Atticora tibialis, Capsiempis flaveola, Dryobates maculifrons, Melanerpes flavifrons, Turdus flavipes","2020-10-17"
"145","2017","S36885386",8.94647549085831,-82.7415927,69,"CR-Puntarenas-Coto Brus - 8,9461x-82,7418 - 15 may. 2017 14:56","Black-faced Solitaire, Costa Rican Warbler, Cattle Egret, Red-headed Barbet, American Dipper, Chestnut-capped Warbler, Acorn Woodpecker, Dark Pewee, Torrent Tyrannulet, White-throated Mountain-gem, Scintillant Hummingbird, Brown-capped Vireo, Hairy Woodpecker, Green Hermit, Gray-breasted Wood-Wren, Silvery-fronted Tapaculo, Bicolored Antbird, Spotted Woodcreeper, Yellow-thighed Brushfinch, Rough-legged Tyrannulet, Slate-throated Redstart, Spangle-cheeked Tanager, Louisiana Waterthrush, Golden-crowned Warbler, Yellow-faced Grassquit, Sulphur-winged Parakeet, Black-throated Green Warbler, Yellow-winged Vireo, Townsend's Warbler, American Kestrel, Tufted Flycatcher, Flame-colored Tanager, Prong-billed Barbet, Dusky Nightjar, Northern Emerald-Toucanet, White-collared Swift, Large-footed Finch, Blue-and-white Swallow, Band-tailed Pigeon, Barred Parakeet, Slaty Flowerpiercer, Black Hawk-Eagle, Mountain Thrush, Collared Redstart, Flame-throated Warbler, Spot-crowned Woodcreeper, Black Guan, Mountain Elaenia, Ochraceous Wren, Spotted Barbtail, Golden-bellied Flycatcher, Yellow-bellied Siskin, Olive-striped Flycatcher, Slaty Antwren, Broad-winged Hawk, Mottled Owl, Black Vulture, Ruddy-capped Nightingale-Thrush, Streak-breasted Treehunter, Resplendent Quetzal, Three-wattled Bellbird, Violet Sabrewing, Black-cheeked Warbler, Collared Trogon, Stripe-tailed Hummingbird, Red-faced Spinetail, Spotted Wood-Quail, Great Black Hawk, White-naped Brushfinch","Myadestes melanops, Basileuterus melanotis, Bubulcus ibis, Eubucco bourcierii, Cinclus mexicanus, Basileuterus delattrii, Melanerpes formicivorus, Contopus lugubris, Serpophaga cinerea, Lampornis castaneoventris, Selasphorus scintilla, Vireo leucophrys, Dryobates villosus, Phaethornis guy, Henicorhina leucophrys, Scytalopus argentifrons, Gymnopithys bicolor, Xiphorhynchus erythropygius, Atlapetes tibialis, Phyllomyias burmeisteri, Myioborus miniatus, Tangara dowii, Parkesia motacilla, Basileuterus culicivorus, Tiaris olivaceus, Pyrrhura hoffmanni, Setophaga virens, Vireo carmioli, Setophaga townsendi, Falco sparverius, Mitrephanes phaeocercus, Piranga bidentata, Semnornis frantzii, Antrostomus saturatus, Aulacorhynchus prasinus, Streptoprocne zonaris, Pezopetes capitalis, Pygochelidon cyanoleuca, Patagioenas fasciata, Bolborhynchus lineola, Diglossa plumbea, Spizaetus tyrannus, Turdus plebejus, Myioborus torquatus, Oreothlypis gutturalis, Lepidocolaptes affinis, Chamaepetes unicolor, Elaenia frantzii, Troglodytes ochraceus, Premnoplex brunnescens, Myiodynastes hemichrysus, Spinus xanthogastrus, Mionectes olivaceus, Myrmotherula schisticolor, Buteo platypterus, Ciccaba virgata, Coragyps atratus, Catharus frantzii, Thripadectes rufobrunneus, Pharomachrus mocinno, Procnias tricarunculatus, Campylopterus hemileucurus, Basileuterus melanogenys, Trogon collaris, Eupherusa eximia, Cranioleuca erythrops, Odontophorus guttatus, Buteogallus urubitinga, Atlapetes albinucha","2017-02-15"
"146","2020","S68924959",3.2532646964054,-76.5993579,58,"Finca Emmanuel","Streaked Saltator, Pale-vented Pigeon, Rusty-margined Flycatcher, Southern Lapwing, Crimson-backed Tanager, House Wren, Bay-headed Tanager, Shiny Cowbird, Ruddy Ground Dove, Red-crowned Woodpecker, Spectacled Parrotlet, Grayish Piculet, Turkey Vulture, Yellow-bellied Elaenia, Blue-necked Tanager, White-throated Crake, Tropical Kingbird, Black-bellied Whistling-Duck, Smooth-billed Ani, Western Emerald, Apical Flycatcher, Blue-black Grassquit, Swallow Tanager, Piratic Flycatcher, Steely-vented Hummingbird, Spot-breasted Woodpecker, Yellow-headed Caracara, Blue-gray Tanager, Little Tinamou, White-tipped Dove, Short-tailed Hawk, Thick-billed Euphonia, Black-billed Thrush, Roadside Hawk, Yellow-crowned Tyrannulet, Andean Motmot, Common Tody-Flycatcher, Great Kiskadee, Marble-faced Bristle-Tyrant, Striped Cuckoo, Yellow-faced Grassquit, Tropical Parula, Gray Seedeater, Blue-and-white Swallow, Bananaquit, Saffron Finch, Mouse-colored Tyrannulet, Black Vulture, Squirrel Cuckoo, Pale-breasted Spinetail, Colombian Chachalaca, Blue-headed Parrot, Yellow-bellied Seedeater, Rufous-tailed Hummingbird, Cattle Egret, Red-eyed Vireo, Scrub Tanager, Bar-crested Antshrike","Saltator striatipectus, Patagioenas cayennensis, Myiozetetes cayanensis, Vanellus chilensis, Ramphocelus dimidiatus, Troglodytes aedon, Tangara gyrola, Molothrus bonariensis, Columbina talpacoti, Melanerpes rubricapillus, Forpus conspicillatus, Picumnus granadensis, Cathartes aura, Elaenia flavogaster, Stilpnia cyanicollis, Laterallus albigularis, Tyrannus melancholicus, Dendrocygna autumnalis, Crotophaga ani, Chlorostilbon melanorhynchus, Myiarchus apicalis, Volatinia jacarina, Tersina viridis, Legatus leucophaius, Saucerottia saucerottei, Colaptes punctigula, Milvago chimachima, Thraupis episcopus, Crypturellus soui, Leptotila verreauxi, Buteo brachyurus, Euphonia laniirostris, Turdus ignobilis, Rupornis magnirostris, Tyrannulus elatus, Momotus aequatorialis, Todirostrum cinereum, Pitangus sulphuratus, Phylloscartes ophthalmicus, Tapera naevia, Tiaris olivaceus, Setophaga pitiayumi, Sporophila intermedia, Pygochelidon cyanoleuca, Coereba flaveola, Sicalis flaveola, Phaeomyias murina, Coragyps atratus, Piaya cayana, Synallaxis albescens, Ortalis columbiana, Pionus menstruus, Sporophila nigricollis, Amazilia tzacatl, Bubulcus ibis, Vireo olivaceus, Stilpnia vitriolina, Thamnophilus multistriatus","2020-05-09"
"147","2010","S30453400",4.42224667016277,101.0589967,54,"Kinta Nature Park, Batu Gajah, Perak","Lesser Coucal, Blue-tailed Bee-eater, White-throated Kingfisher, Green-billed Malkoha, Yellow Bittern, White-breasted Woodswallow, Brown Shrike, Eurasian Moorhen, Blue-eared Kingfisher, Olive-backed Sunbird, White-bellied Sea-Eagle, Gray Heron, White-browed Crake, Red-wattled Lapwing, Greater Coucal, Baya Weaver, Purple Heron, Gray-headed Swamphen, Malaysian Pied-Fantail, Asian Glossy Starling, Paddyfield Pipit, Pink-necked Green-Pigeon, Common Tailorbird, Great Egret, Lineated Barbet, Gray-headed Fish-Eagle, White-breasted Waterhen, Daurian Starling, Spotted Dove, Intermediate Egret, Black-naped Oriole, Cattle Egret, Plaintive Cuckoo, Common Kingfisher, Common Myna, Barred Buttonquail, Yellow-vented Bulbul, Eurasian Tree Sparrow, Asian Emerald Dove, Stork-billed Kingfisher, Japanese Sparrowhawk, Little Egret, Pied Triller, Jungle Myna, Yellow-bellied Prinia, Asian Koel, Scaly-breasted Munia, Zebra Dove, Cinnamon Bittern, Little Grebe, Black-crowned Night-Heron, Pacific Swallow, Osprey, Common Iora","Centropus bengalensis, Merops philippinus, Halcyon smyrnensis, Phaenicophaeus tristis, Ixobrychus sinensis, Artamus leucorynchus, Lanius cristatus, Gallinula chloropus, Alcedo meninting, Cinnyris jugularis, Haliaeetus leucogaster, Ardea cinerea, Poliolimnas cinereus, Vanellus indicus, Centropus sinensis, Ploceus philippinus, Ardea purpurea, Porphyrio poliocephalus, Rhipidura javanica, Aplonis panayensis, Anthus rufulus, Treron vernans, Orthotomus sutorius, Ardea alba, Psilopogon lineatus, Haliaeetus ichthyaetus, Amaurornis phoenicurus, Agropsar sturninus, Streptopelia chinensis, Ardea intermedia, Oriolus chinensis, Bubulcus ibis, Cacomantis merulinus, Alcedo atthis, Acridotheres tristis, Turnix suscitator, Pycnonotus goiavier, Passer montanus, Chalcophaps indica, Pelargopsis capensis, Accipiter gularis, Egretta garzetta, Lalage nigra, Acridotheres fuscus, Prinia flaviventris, Eudynamys scolopaceus, Lonchura punctulata, Geopelia striata, Ixobrychus cinnamomeus, Tachybaptus ruficollis, Nycticorax nycticorax, Hirundo tahitica, Pandion haliaetus, Aegithina tiphia","2010-01-24"
"148","2019","S56339162",29.7073002138399,78.6525951089465,51,"Chokham","Alexandrine Parakeet, Ashy Drongo, Bar-winged Flycatcher-shrike, Bay-backed Shrike, Black Bulbul, Black-crested Bulbul, Black-hooded Oriole, Blue-throated Barbet, Blue-throated Flycatcher, Brown Boobook, Brown-headed Barbet, Chestnut-bellied Nuthatch, Chestnut-tailed Starling, Cinereous Tit, Common Hawk-Cuckoo, Common Myna, Common Tailorbird, Coppersmith Barbet, Crimson Sunbird, Dollarbird, Gray-bellied Cuckoo, Gray-breasted Prinia, Gray-headed Woodpecker, Great Slaty Woodpecker, Hair-crested Drongo, Indian Cuckoo, Indian Gray Hornbill, Indian Paradise-Flycatcher, Indian Roller, Jungle Babbler, Large Cuckooshrike, Large-tailed Nightjar, Lesser Yellownape, Lineated Barbet, Oriental Magpie-Robin, Oriental Pied-Hornbill, Painted Stork, Pale-billed Flowerpecker, Plum-headed Parakeet, Puff-throated Babbler, Purple Sunbird, Red Junglefowl, Red-billed Blue-Magpie, Red-breasted Parakeet, Red-vented Bulbul, Red-wattled Lapwing, Rosy Minivet, Spotted Dove, White-crested Laughingthrush, White-throated Fantail, Yellow-footed Green-Pigeon","Psittacula eupatria, Dicrurus leucophaeus, Hemipus picatus, Lanius vittatus, Hypsipetes leucocephalus, Rubigula flaviventris, Oriolus xanthornus, Psilopogon asiaticus, Cyornis rubeculoides, Ninox scutulata, Psilopogon zeylanicus, Sitta cinnamoventris, Sturnia malabarica, Parus cinereus, Hierococcyx varius, Acridotheres tristis, Orthotomus sutorius, Psilopogon haemacephalus, Aethopyga siparaja, Eurystomus orientalis, Cacomantis passerinus, Prinia hodgsonii, Picus canus, Mulleripicus pulverulentus, Dicrurus hottentottus, Cuculus micropterus, Ocyceros birostris, Terpsiphone paradisi, Coracias benghalensis, Argya striata, Coracina macei, Caprimulgus macrurus, Picus chlorolophus, Psilopogon lineatus, Copsychus saularis, Anthracoceros albirostris, Mycteria leucocephala, Dicaeum erythrorhynchos, Psittacula cyanocephala, Pellorneum ruficeps, Cinnyris asiaticus, Gallus gallus, Urocissa erythroryncha, Psittacula alexandri, Pycnonotus cafer, Vanellus indicus, Pericrocotus roseus, Streptopelia chinensis, Garrulax leucolophus, Rhipidura albicollis, Treron phoenicopterus","2019-05-16"
"149","2019","S52352237",3.88806099572581,-76.6017008,71,"RN Rio Bravo--Carretera","Red-faced Spinetail, Masked Trogon, Black-billed Thrush, Roadside Hawk, Grayish Piculet, Crowned Woodnymph, Orange-bellied Euphonia, Azara's Spinetail, Southern Rough-winged Swallow, Silver-throated Tanager, Mourning Warbler, Yellow-faced Grassquit, Golden-crowned Flycatcher, Cinnamon Flycatcher, Crimson-rumped Toucanet, Scrub Tanager, Slate-throated Redstart, Bay Wren, Barred Hawk, Canada Warbler, Olive-striped Flycatcher, Black-winged Saltator, Slaty-capped Flycatcher, Swallow-tailed Kite, Club-winged Manakin, Red-headed Barbet, Summer Tanager, Golden-faced Tyrannulet, Black Phoebe, Multicolored Tanager, Yellow-bellied Seedeater, Rufous-winged Tanager, Whiskered Wren, Chestnut Wood-Quail, Bronze-winged Parrot, Palm Tanager, White-lined Tanager, Yellow-headed Caracara, Squirrel Cuckoo, Metallic-green Tanager, Slaty Spinetail, American Kestrel, White-winged Becard, Andean Solitaire, Blue-gray Tanager, White-collared Swift, Toucan Barbet, Tropical Kingbird, Black Hawk-Eagle, Violet-tailed Sylph, Booted Racket-tail, Green Honeycreeper, Flame-rumped Tanager, Black Vulture, Rusty-margined Flycatcher, Bananaquit, Tropical Parula, Apical Flycatcher, Striped Cuckoo, Chestnut-headed Oropendola, Blue-winged Mountain Tanager, Three-striped Warbler, Crimson-backed Tanager, Tricolored Brushfinch, Blackburnian Warbler, Plain Antvireo, Yellow-backed Oriole, White-bearded Manakin, Smooth-billed Ani, Short-tailed Hawk, Golden-winged Warbler","Cranioleuca erythrops, Trogon personatus, Turdus ignobilis, Rupornis magnirostris, Picumnus granadensis, Thalurania colombica, Euphonia xanthogaster, Synallaxis azarae, Stelgidopteryx ruficollis, Tangara icterocephala, Geothlypis philadelphia, Tiaris olivaceus, Myiodynastes chrysocephalus, Pyrrhomyias cinnamomeus, Aulacorhynchus haematopygus, Stilpnia vitriolina, Myioborus miniatus, Cantorchilus nigricapillus, Morphnarchus princeps, Cardellina canadensis, Mionectes olivaceus, Saltator atripennis, Leptopogon superciliaris, Elanoides forficatus, Machaeropterus deliciosus, Eubucco bourcierii, Piranga rubra, Zimmerius chrysops, Sayornis nigricans, Chlorochrysa nitidissima, Sporophila nigricollis, Tangara lavinia, Pheugopedius mystacalis, Odontophorus hyperythrus, Pionus chalcopterus, Thraupis palmarum, Tachyphonus rufus, Milvago chimachima, Piaya cayana, Tangara labradorides, Synallaxis brachyura, Falco sparverius, Pachyramphus polychopterus, Myadestes ralloides, Thraupis episcopus, Streptoprocne zonaris, Semnornis ramphastinus, Tyrannus melancholicus, Spizaetus tyrannus, Aglaiocercus coelestis, Ocreatus underwoodii, Chlorophanes spiza, Ramphocelus flammigerus, Coragyps atratus, Myiozetetes cayanensis, Coereba flaveola, Setophaga pitiayumi, Myiarchus apicalis, Tapera naevia, Psarocolius wagleri, Anisognathus somptuosus, Basileuterus tristriatus, Ramphocelus dimidiatus, Atlapetes tricolor, Setophaga fusca, Dysithamnus mentalis, Icterus chrysater, Manacus manacus, Crotophaga ani, Buteo brachyurus, Vermivora chrysoptera","2019-02-03"
"150","1988","S86860420",10.147303162308,-83.9463492415404,88,"PN Braulio Carrillo--Puente Río Sucio","Chestnut-sided Warbler, Wedge-billed Woodcreeper, Vaux's Swift, Short-billed Pigeon, Black-striped Sparrow, Gray-breasted Wood-Wren, White-breasted Wood-Wren, Fasciated Antshrike, Variable Seedeater, Gray-capped Flycatcher, Common Chlorospingus, Emerald Tanager, Black-cheeked Woodpecker, Green Honeycreeper, Social Flycatcher, Tawny-capped Euphonia, Gray-rumped Swift, Golden-browed Chlorophonia, Tawny-crested Tanager, Black-throated Trogon, Silver-throated Tanager, Bananaquit, Slaty-backed Nightingale-Thrush, Buff-throated Saltator, White-ruffed Manakin, Acadian Flycatcher, Yellow-eared Toucanet, Rufous-collared Sparrow, Blue-gray Tanager, Blue-and-gold Tanager, Azure-hooded Jay, Boat-billed Flycatcher, Purple-crowned Fairy, White-throated Crake, Great-tailed Grackle, Spotted Woodcreeper, Masked Tityra, Scale-crested Pygmy-Tyrant, Green Shrike-Vireo, Black-faced Solitaire, Eastern Wood-Pewee, Black-thighed Grosbeak, Sharpbill, Spangle-cheeked Tanager, Gartered Trogon, Cattle Egret, Cinnamon Becard, Lineated Woodpecker, Stripe-throated Hermit, Scarlet-rumped Cacique, Tufted Flycatcher, Golden-bellied Flycatcher, Palm Tanager, Hepatic Tanager, Blue-and-white Swallow, Tennessee Warbler, White-collared Swift, Broad-winged Hawk, Speckled Tanager, Swallow-tailed Kite, Long-tailed Tyrant, Lattice-tailed Trogon, Great Kiskadee, Slate-throated Redstart, Tropical Kingbird, Pale-vented Thrush, Chestnut-headed Oropendola, Baltimore Oriole, Wilson's Warbler, Crowned Woodnymph, Band-backed Wren, Brown-hooded Parrot, Bicolored Hawk, Southern Rough-winged Swallow, Rufous Piha, Black-faced Grosbeak, Cinnamon Woodpecker, Dark Pewee, Scarlet-thighed Dacnis, White-crowned Parrot, Crested Guan, Black-headed Nightingale-Thrush, Bay Wren, Russet Antshrike, Squirrel Cuckoo, Crimson-collared Tanager, Black-and-yellow Tanager, Black-crowned Tityra","Setophaga pensylvanica, Glyphorynchus spirurus, Chaetura vauxi, Patagioenas nigrirostris, Arremonops conirostris, Henicorhina leucophrys, Henicorhina leucosticta, Cymbilaimus lineatus, Sporophila corvina, Myiozetetes granadensis, Chlorospingus flavopectus, Tangara florida, Melanerpes pucherani, Chlorophanes spiza, Myiozetetes similis, Euphonia anneae, Chaetura cinereiventris, Chlorophonia callophrys, Tachyphonus delatrii, Trogon rufus, Tangara icterocephala, Coereba flaveola, Catharus fuscater, Saltator maximus, Corapipo altera, Empidonax virescens, Selenidera spectabilis, Zonotrichia capensis, Thraupis episcopus, Bangsia arcaei, Cyanolyca cucullata, Megarynchus pitangua, Heliothryx barroti, Laterallus albigularis, Quiscalus mexicanus, Xiphorhynchus erythropygius, Tityra semifasciata, Lophotriccus pileatus, Vireolanius pulchellus, Myadestes melanops, Contopus virens, Pheucticus tibialis, Oxyruncus cristatus, Tangara dowii, Trogon caligatus, Bubulcus ibis, Pachyramphus cinnamomeus, Dryocopus lineatus, Phaethornis striigularis, Cacicus uropygialis, Mitrephanes phaeocercus, Myiodynastes hemichrysus, Thraupis palmarum, Piranga flava, Pygochelidon cyanoleuca, Leiothlypis peregrina, Streptoprocne zonaris, Buteo platypterus, Ixothraupis guttata, Elanoides forficatus, Colonia colonus, Trogon clathratus, Pitangus sulphuratus, Myioborus miniatus, Tyrannus melancholicus, Turdus obsoletus, Psarocolius wagleri, Icterus galbula, Cardellina pusilla, Thalurania colombica, Campylorhynchus zonatus, Pyrilia haematotis, Accipiter bicolor, Stelgidopteryx ruficollis, Lipaugus unirufus, Caryothraustes poliogaster, Celeus loricatus, Contopus lugubris, Dacnis venusta, Pionus senilis, Penelope purpurascens, Catharus mexicanus, Cantorchilus nigricapillus, Thamnistes anabatinus, Piaya cayana, Ramphocelus sanguinolentus, Chrysothlypis chrysomelas, Tityra inquisitor","1988-04-01"
